{
  "trip_id": "t_123",
  "style": "documentary",
  "output": {
    "width": 1920,
    "height": 1080,
    "fps": 30
  },
  "title": {
    "text": "Kyoto",
    "subtitle": "October 2026",
    "duration_s": 3.0
  },
  "clips": [
    {
      "moment_id": "m_01",
      "in_s": 12.0,
      "out_s": 20.0,
      "transition_in": "dissolve",
      "transition_s": 1.0,
      "speed_ramp": null,
      "caption": "Kyoto, Japan"
    },
    {
      "moment_id": "m_02",
      "in_s": 12.5,
      "out_s": 19.5,
      "transition_in": "dissolve",
      "transition_s": 1.0,
      "speed_ramp": null,
      "caption": "Red torii gates lining a stone path"
    },
    {
      "moment_id": "m_03",
      "in_s": 11.5,
      "out_s": 18.5,
      "transition_in": "dissolve",
      "transition_s": 1.0,
      "speed_ramp": null,
      "caption": "Two people walking under paper lanterns"
    },
    {
      "moment_id": "m_04",
      "in_s": 13.0,
      "out_s": 19.0,
      "transition_in": "dissolve",
      "transition_s": 1.0,
      "speed_ramp": null,
      "caption": "Bowl of ramen on a wooden counter"
    },
    {
      "moment_id": "m_06",
      "in_s": 11.5,
      "out_s": 18.5,
      "transition_in": "dissolve",
      "transition_s": 1.0,
      "speed_ramp": null,
      "caption": null
    },
    {
      "moment_id": "m_08",
      "in_s": 13.0,
      "out_s": 21.0,
      "transition_in": "dissolve",
      "transition_s": 1.0,
      "speed_ramp": null,
      "caption": "Wooden temple hall on a hillside"
    },
    {
      "moment_id": "m_10",
      "in_s": 12.5,
      "out_s": 19.5,
      "transition_in": "dissolve",
      "transition_s": 1.0,
      "speed_ramp": null,
      "caption": "Bamboo grove with light through the stalks"
    },
    {
      "moment_id": "m_11",
      "in_s": 12.0,
      "out_s": 20.0,
      "transition_in": "dissolve",
      "transition_s": 1.0,
      "speed_ramp": null,
      "caption": null
    },
    {
      "moment_id": "m_12",
      "in_s": 12.0,
      "out_s": 20.0,
      "transition_in": "dissolve",
      "transition_s": 1.0,
      "speed_ramp": null,
      "caption": "City lights seen from a hilltop at dusk"
    }
  ],
  "music": {
    "track": "documentary_01",
    "gain_db": -20,
    "duck_original_audio": true
  },
  "end_card": {
    "text": "Made with Roamory",
    "duration_s": 2.0
  }
}
