{
  "trip_id": "t_123",
  "style": "cinematic",
  "output": {
    "width": 1920,
    "height": 1080,
    "fps": 30
  },
  "title": {
    "text": "Kyoto",
    "subtitle": "October 2026",
    "duration_s": 2.5
  },
  "clips": [
    {
      "moment_id": "m_01",
      "in_s": 13.0,
      "out_s": 19.0,
      "transition_in": "fade",
      "transition_s": 0.6,
      "speed_ramp": null,
      "caption": null
    },
    {
      "moment_id": "m_02",
      "in_s": 13.0,
      "out_s": 19.0,
      "transition_in": "fade",
      "transition_s": 0.6,
      "speed_ramp": null,
      "caption": null
    },
    {
      "moment_id": "m_03",
      "in_s": 11.5,
      "out_s": 18.5,
      "transition_in": "fade",
      "transition_s": 0.6,
      "speed_ramp": {
        "from": 4.0,
        "to": 1.0,
        "over_s": 2.0
      },
      "caption": null
    },
    {
      "moment_id": "m_06",
      "in_s": 12.5,
      "out_s": 17.5,
      "transition_in": "fade",
      "transition_s": 0.6,
      "speed_ramp": null,
      "caption": null
    },
    {
      "moment_id": "m_07",
      "in_s": 13.0,
      "out_s": 19.0,
      "transition_in": "fade",
      "transition_s": 0.6,
      "speed_ramp": null,
      "caption": null
    },
    {
      "moment_id": "m_08",
      "in_s": 14.0,
      "out_s": 20.0,
      "transition_in": "fade",
      "transition_s": 0.6,
      "speed_ramp": null,
      "caption": null
    },
    {
      "moment_id": "m_10",
      "in_s": 12.5,
      "out_s": 19.5,
      "transition_in": "fade",
      "transition_s": 0.6,
      "speed_ramp": null,
      "caption": null
    },
    {
      "moment_id": "m_11",
      "in_s": 13.5,
      "out_s": 18.5,
      "transition_in": "fade",
      "transition_s": 0.6,
      "speed_ramp": null,
      "caption": null
    },
    {
      "moment_id": "m_12",
      "in_s": 13.0,
      "out_s": 19.0,
      "transition_in": "fade",
      "transition_s": 0.6,
      "speed_ramp": null,
      "caption": null
    }
  ],
  "music": {
    "track": "cinematic_01",
    "gain_db": -14,
    "duck_original_audio": true
  },
  "end_card": {
    "text": "Made with Roamory",
    "duration_s": 2.0
  }
}
