{
  "trip_id": "t_123",
  "style": "reels",
  "output": {
    "width": 1080,
    "height": 1920,
    "fps": 30
  },
  "title": {
    "text": "Kyoto",
    "subtitle": "October 2026",
    "duration_s": 1.5
  },
  "clips": [
    {
      "moment_id": "m_01",
      "in_s": 14.8,
      "out_s": 17.3,
      "transition_in": "cut",
      "transition_s": 0,
      "speed_ramp": null,
      "caption": null
    },
    {
      "moment_id": "m_02",
      "in_s": 14.8,
      "out_s": 17.3,
      "transition_in": "cut",
      "transition_s": 0,
      "speed_ramp": null,
      "caption": null
    },
    {
      "moment_id": "m_03",
      "in_s": 13.5,
      "out_s": 16.5,
      "transition_in": "cut",
      "transition_s": 0,
      "speed_ramp": {
        "from": 4.0,
        "to": 1.0,
        "over_s": 1.0
      },
      "caption": null
    },
    {
      "moment_id": "m_04",
      "in_s": 15.0,
      "out_s": 17.0,
      "transition_in": "cut",
      "transition_s": 0,
      "speed_ramp": null,
      "caption": null
    },
    {
      "moment_id": "m_06",
      "in_s": 13.8,
      "out_s": 16.3,
      "transition_in": "cut",
      "transition_s": 0,
      "speed_ramp": null,
      "caption": null
    },
    {
      "moment_id": "m_07",
      "in_s": 14.8,
      "out_s": 17.3,
      "transition_in": "cut",
      "transition_s": 0,
      "speed_ramp": null,
      "caption": null
    },
    {
      "moment_id": "m_08",
      "in_s": 15.8,
      "out_s": 18.3,
      "transition_in": "cut",
      "transition_s": 0,
      "speed_ramp": null,
      "caption": null
    },
    {
      "moment_id": "m_09",
      "in_s": 15.0,
      "out_s": 17.0,
      "transition_in": "cut",
      "transition_s": 0,
      "speed_ramp": null,
      "caption": null
    },
    {
      "moment_id": "m_10",
      "in_s": 14.5,
      "out_s": 17.5,
      "transition_in": "cut",
      "transition_s": 0,
      "speed_ramp": null,
      "caption": null
    },
    {
      "moment_id": "m_11",
      "in_s": 14.8,
      "out_s": 17.3,
      "transition_in": "cut",
      "transition_s": 0,
      "speed_ramp": null,
      "caption": null
    },
    {
      "moment_id": "m_12",
      "in_s": 14.8,
      "out_s": 17.3,
      "transition_in": "cut",
      "transition_s": 0,
      "speed_ramp": null,
      "caption": null
    }
  ],
  "music": {
    "track": "reels_01",
    "gain_db": -10,
    "duck_original_audio": true
  },
  "end_card": {
    "text": "Made with Roamory",
    "duration_s": 2.0
  }
}
